NUMTRAM;DENOMINACION;FINAL;DENOMINACION_SIMPLE
0;Registro Sol.;0;Reg. Sol.
505;Recursos, requerimientos y otros actos relacionados con el expediente;1;Recur.s, requerimientos otros actos relacionados el expediente
343;Requerimiento de informes a otras unidades: ;0;Req. informes otras unidades: 
251;Informe del Servicio Forestal;0;Inf. Servicio Forestal
100;Fin del procedimiento;0;Fin proc.
55;Resolución inadmisión, acumulación de expedientes o desistimiento;0;Resol. inadmisión, acumulación expedientes o desistimiento
10;Subsanación de solicitud o requerimiento de documentación;0;Subsanación sol. o requerimiento doc.
1;Presentación de la solicitud;0;Present. sol.
